{
  "schemaVersion": 1,
  "runStamp": "cells4",
  "overall": "PASS",
  "legs": {
    "pixel": {
      "status": "PASS",
      "failures": [],
      "notes": [
        "pixel mismatch=0.0405 flatBgDrift=0.0123 liveMasked=0.0000: home",
        "pixel mismatch=0.0320 flatBgDrift=0.0018 liveMasked=0.0000: organization",
        "pixel mismatch=0.0261 flatBgDrift=0.0026 liveMasked=0.2250: departments",
        "pixel mismatch=0.0285 flatBgDrift=0.0035 liveMasked=0.1811: doctors",
        "pixel mismatch=0.0380 flatBgDrift=0.0124 liveMasked=0.3187: schedules",
        "pixel mismatch=0.0580 flatBgDrift=0.0093 liveMasked=0.0000: department-create",
        "pixel mismatch=0.0549 flatBgDrift=0.0103 liveMasked=0.0000: doctor-create",
        "pixel mismatch=0.0707 flatBgDrift=0.0157 liveMasked=0.0000: schedule-create",
        "pixel mismatch=0.0680 flatBgDrift=0.0147 liveMasked=0.1202: schedule-batch"
      ]
    },
    "geom": {
      "status": "PASS",
      "failures": [],
      "notes": []
    },
    "text": {
      "status": "PASS",
      "failures": [],
      "notes": []
    },
    "icons": {
      "status": "PASS",
      "failures": [],
      "notes": []
    },
    "cells": {
      "status": "PASS",
      "failures": [],
      "notes": []
    },
    "layout": {
      "status": "PASS",
      "failures": [],
      "notes": [
        "content layer: 14 of 16 marked container instance(s) judged; 2 not judged (no measurable children, or container did not grow)"
      ]
    },
    "data": {
      "status": "PASS",
      "failures": [],
      "notes": []
    },
    "impl": {
      "status": "PASS",
      "failures": [],
      "notes": [
        "hardcode scan: 39 source files, 16 colour literals (0 new), 11 IR fallbacks (0 new), baseline entries=29",
        "modal-card SSOT: 4 card(s) cross-checked against the manifest"
      ]
    }
  },
  "runtime": {
    "webOk": true,
    "apiOk": true
  }
}
